ID,AppName,Description,Usedfor,Rating,Review,Date,UsefulCount
1,Airbnb , A booking service for unique lodging and immersive local experiences , Travel & Hospitality,2.8,"I had an amazing experience staying in local homes while traveling! The hosts are usually friendly, and it's a much more authentic experience than staying in hotels.",24-Jan-03,113
2,Wish , A global ecommerce platform known for discounted goods directly from manufacturers , Shopping & Finance,3.6,"The deals are incredible, though sometimes you get what you pay for. I find it fun to browse, especially for unique items and small gadgets!",8-Apr-23,98
3,Flipboard , A news app that curates trending stories and articles based on user interests , News & Media,3.5,"This app keeps me informed and organized. I love curating my own magazines, and the interface makes reading enjoyable.",27-Jan-08,291
4,Udemy ," A platform for learning, with courses across various disciplines. ", Productivity & Learning,2.5,"I?ve learned so many new skills with Udemy! The course variety is fantastic, and I appreciate the lifetime access to content.",1-Jan-00,96
5,Stumble Guys , A popular multiplayer arcade game with over the top obstacles., Productivity & Learning,3.4,"Such a fun and chaotic game to play with friends! The obstacle courses are hilarious, and it never gets old competing for the win.",28-May-09,192
6,BeReal ," A realtime, candid photo sharing app that surged in popularity. ", Social Media & Communication Apps,2,"It?s refreshing to see real, unfiltered photos of friends! The notification timing adds a fun, spontaneous element to social media.",21-Mar-09,204
7,Photoleap , A robust photo editor leveraging AI for effects and enhancements. , AI & Photography,4.1,"This app is a powerhouse for photo editing! The tools are super easy to use, yet advanced enough to make my photos look professional.",10-Sep-03,77
8,LastPass , A secure password manager to store and autofill login credentials , Security & Privacy,3,"I feel secure knowing my passwords are safely stored. It?s a huge time-saver, and the auto-login feature is so convenient.",19-Sep-08,241
9,Bumble BFF ," A spin off of the dating app Bumble, focused on connecting people for friendships. ", Social Media & Communication Apps,3,Bumble BFF made meeting new friends feel easy and safe! I?ve already met some amazing people with shared interests.,31-Mar-09,190
10,WeChat ," A super app popular in China that combines messaging, social media, payments, and more. ", Social Media & Communication Apps,3.3,WeChat is like a Swiss Army knife! I use it daily not just for messaging but also for payments and keeping up with friends.,31-May-10,140
11,Notion ," A workspace app for organizing notes, tasks, and team projects. ", Productivity & Learning,3.7,"Notion transformed how I organize my life! It's versatile enough for notes, project management, and goal tracking.",5-Mar-07,172
12,LibriVox , Access free audiobooks of public domain titles read by volunteers , Audio & Literature,2.6,A brilliant app for listening to classic audiobooks. I appreciate the volunteers who bring these books to life with their narration.,29-Nov-11,144
13,Geocaching , Adventure app for outdoor treasure hunting using GPS coordinates , Travel & Adventure,1.1,"It?s an adventurous app! I love going on treasure hunts with friends, and it?s a great way to explore new areas.",26-May-21,115
14,Anchor ," All in one platform for recording, editing, and distributing podcasts ", Audio & Media,4.3,"Anchor made it easy for me to start my podcast! The editing tools are straightforward, and distribution to other platforms is seamless.",25-Mar-00,245
15,iNaturalist , Allows users to identify plants and animals by uploading photos , Education & Nature,1.6,"iNaturalist is great for nature enthusiasts! I?ve identified plants and animals around me, and the community is very helpful.",29-Jan-04,207
16,Cash App ," Allows users to send, spend, save, and invest money, with Bitcoin trading options. ", Shopping & Finance,1.1,"Cash App is perfect for quick transactions. I love the clean interface, and Bitcoin investing is a nice added feature.",6-Mar-13,188
17,Headout ," App for booking tours, activities, and local experiences ", Travel & Experiences,3.7,Headout made booking activities so easy! I found discounts on tours and experiences that made my trip unforgettable.,31-Jul-10,82
18,Fishbrain ," App for fishing enthusiasts that offers tips, maps, and catches ", Outdoors & Sports,5,Fantastic app for anglers! I find it incredibly helpful to track catches and discover new fishing spots with the community.,7-Nov-10,250
19,Walmart ," App for online grocery shopping, store information, and deals ", Shopping & Finance,3.2,"Great app for shopping on the go. I can browse items, check availability, and even do curbside pickup, which is very convenient.",13-Nov-20,76
20,Meetup , App for organizing and attending local in person or virtual group events based on shared interests. , Social Media & Communication Apps,4.3,Meetup helped me find local groups for my hobbies. It?s been great for expanding my social circle and trying new activities.,26-Dec-00,265
21,Be My Eyes , App that connects visually impaired people with volunteers for assistance , Accessibility,3.3,An amazing app for assisting people with visual impairments. I feel fulfilled knowing I can help someone even from a distance.,23-Sep-19,288
22,Bitmoji , App that creates personalized cartoon avatars for use in messaging , Social Media & Communication,1.7,"Creating my own Bitmoji is so fun, and it?s a great way to add personality to my messages! The designs and outfits are top-notch.",23-Nov-08,271
23,SkySafari ," Astronomy app that provides star maps, tracking, and educational info ", Education & Exploration,1.9,"SkySafari has transformed my stargazing experience! The details on celestial objects are amazing, and it's very user-friendly.",15-Mar-17,88
24,SkySafari , Astronomy tool offering detailed sky maps and educational content on space , Education & Exploration,3,"Perfect for astronomy lovers! I can easily identify stars and planets, and the telescope control feature is a game-changer.",8-Jul-17,117
25,Clubhouse , Audiofocused social media app popularized for live discussions. , Social Media & Communication Apps,2,It?s fascinating to join discussions with people from all over the world. Great for networking and hearing unique perspectives. ,7-Oct-07,86
26,YouCam Makeup , Augmented reality beauty app that offers virtual makeup tryons, AI & Photography,3.1,"Amazing for virtual makeup try-ons! It?s fun to experiment with different looks, and it helps me decide on styles before buying.",13-Nov-08,242
27,Otter.ai ," Automated transcription app for meetings, lectures, and interviews ", Productivity & Learning,1,"Otter.ai has made transcribing meetings so much easier. The accuracy is impressive, and the time saved is invaluable!",14-Apr-07,87
28,Fortnite , Battle royale game with building mechanics and live in game events., Gaming,2.2,"The graphics and gameplay are incredible, and I love the frequent updates. It?s a fun and competitive game with a huge community.",12-Jun-16,294
29,Flip , Beautyfocused ecommerce app with user generated video reviews , Shopping & Beauty,4.7,Great for discovering new products through real reviews! I enjoy seeing honest feedback from people who actually use the products.,7-Mar-23,300
30,Microsoft Teams , Became critical during the pandemic for remote work collaboration. , Productivity & Learning,3.6,"Essential for work! The integration with other Microsoft apps is seamless, and it makes remote collaboration a breeze.",21-Jul-21,55
31,Airbnb , Book stays and experiences offered by locals worldwide , Travel & Hospitality,1.5,"I love finding unique stays on Airbnb, and the reviews help me choose places that feel like home. Great for travelers!",3-Mar-04,68
32,Elevate ," Brain training app with games to improve focus, processing speed, and more ", Productivity & Learning,3.8,"Elevate is fantastic for daily mental workouts. The games are fun, and I feel sharper and more focused each time I use it.",27-Dec-21,95
33,Elevate ," Braintraining app with games to improve focus, processing speed, and more ", Productivity & Learning,1.5,Elevate?s games are not only enjoyable but also challenging. I notice improvements in my cognitive skills over time.,8-Apr-20,115
34,Clash Royale , Brought strategy gaming to mobile. , Gaming,2.2,"This game is addictive! I love the strategic battles, and it?s great that I can play quick matches anytime.",20-Feb-01,121
35,YNAB (You Need a Budget) , Budgeting tool focusing on proactive financial planning , Shopping & Finance,1.6,Best budgeting tool out there. It?s taught me to manage my money better and achieve financial goals.,31-May-10,196
36,Klarna ," Buy now, pay later platform used in various ecommerce setups. ", Shopping & Finance,1.7,Shopping with Klarna makes budgeting easier. The buy-now-pay-later feature helps me spread out payments without interest.,7-Feb-18,214
37,Timepage , Calendar app by Moleskine with intuitive design and features , Productivity & Learning,2.7,Beautiful and functional calendar app. I appreciate the intuitive design and the attention to small details.,30-May-02,63
38,Rakuten , Cashback and rewards app for online shopping. , Shopping & Finance,4.6,"Rakuten is a must-have for anyone who shops online! I get cashback on almost every purchase, which really adds up.",29-Jan-03,80
39,Dropbox , Cloud storage service allowing users to save and share files online , Productivity & Learning,3.2,Perfect for file storage and sharing. I rely on Dropbox to access important documents on the go.,1-May-19,199
40,Elevate ," Cognitive training app with games to boost memory, focus, and math skills ", Productivity & Learning,2.4,"Elevate keeps me mentally sharp, and I look forward to the daily exercises. It?s like a personal trainer for my brain.",14-May-03,183
41,GoodRx , Compares prescription prices and provides coupons for discounts at pharmacies. , Shopping & Finance,2.1,This app has saved me so much on prescriptions. I highly recommend it for finding the best prices at local pharmacies.,27-Feb-05,97
42,Peloton ," Connected fitness app for cycling, running, and strength workouts. ", Health & Fitness,3.1,Peloton has made fitness more accessible for me. The variety of classes and instructors keeps me motivated.,6-Jun-18,149
43,Zocdoc , Connects patients with doctors and allows scheduling of appointments , Health & Wellness,2.1,Zocdoc makes finding doctors and booking appointments incredibly easy. I love being able to read reviews beforehand.,6-Feb-04,159
44,Hulu , Continued strong U.S. viewership. , Video and Entertainment,3.2,Hulu has a great variety of shows and movies. I love the exclusive content and the option for live TV.,6-Sep-17,66
45,WhatsApp , Continues as a global messaging leader. , Social Media & Communication Apps,2.4,The best app for staying connected globally! The free international messaging and calling are so helpful.,10-Jun-17,292
46,Subway Surfers , Continues to be a highly downloaded endless runner. , Productivity & Learning,3.2,"A classic! I love the fast-paced action, and it?s always exciting to beat my previous high scores.",24-Oct-17,111
47,Netflix ," Continues to lead streaming, innovating with interactive content. ", Video and Entertainment,1.5,"Netflix has an incredible selection, and I especially love their original series. Perfect for a cozy movie night.",23-Dec-20,173
48,Enlight Pixaloop , Creates animated photos by adding motion effects to still images. , AI & Photography,4.8,Pixaloop brings my photos to life! I love adding subtle animations and effects; it?s mesmerizing.,7-May-23,118
49,Skillshare ," Creative learning platform offering classes on design, photography, and more ", Education & Creativity,3.9,Skillshare is a game-changer for learning creative skills. The courses are well-structured and easy to follow.,16-Aug-19,162
50,Coinbase ," Cryptocurrency exchange and wallet app for buying, selling, and storing crypto. ", Shopping & Finance,1.3,"Great app for beginners in crypto! It?s user-friendly, and I appreciate the educational content on trading.",28-Feb-08,68
51,Binance , Cryptocurrency exchange platform offering a wide variety of crypto assets and trading tools , Shopping & Finance,3.7,"Binance offers extensive trading options for crypto enthusiasts. The interface is robust, though it may feel overwhelming at first.",2-Nov-18,142
52,Bitmoji , Customizable avatar app that integrates with messaging platforms , Social Media & Communication,3,"Creating a Bitmoji avatar that looks like me is so fun! It adds a unique, personal touch to my chats.",20-Sep-23,147
53,NFL+ , Dedicated to streaming live NFL games and content. , Video and Entertainment,1.8,NFL+ makes watching games on the go super convenient. I love being able to catch live games wherever I am.,24-Oct-22,211
54,FaceMagic , Deepfake app for swapping faces in videos and photos using AI. , AI & Photography,1.2,This app is so entertaining! The face-swapping tech is impressive and brings a lot of laughs when I use it with friends.,10-Feb-01,93
55,PUBG Mobile , Defined mobile battle royale. , Gaming,2.6,PUBG Mobile is a well-designed battle royale game with stunning graphics. The competitive gameplay keeps me coming back.,1-May-13,91
56,Grubhub , Delivers food from local restaurants directly to your door , Food & Drink,1.7,"Grubhub offers a wide selection of restaurants, and I appreciate the tracking feature to see when my food will arrive.",2-Apr-07,244
57,Chime , Digital banking app with features like savings tools and no fee accounts , Shopping & Finance,2.2,"Banking with Chime is easy and convenient, especially with its fee-free ATMs and early paycheck feature.",25-Aug-21,232
58,OverDrive , Digital library app for borrowing ebooks and audiobooks , Productivity & Learning,3.2,A fantastic app for borrowing e-books and audiobooks from my local library. It?s free and has a great selection.,19-Sep-13,171
59,Eventbrite ," Discover and book local events, workshops, and activities ", Social & Events,2.5,Eventbrite is perfect for finding local events. I?ve discovered many fun activities and festivals I wouldn?t have known about otherwise.,14-Jul-18,256
60,Microsoft Lens ," Document scanner that digitizes notes, images, and text for easy sharing ", Productivity & Learning,3,This app makes scanning documents easy and fast. I use it all the time for work and personal organization.,9-Jan-23,274
61,Microsoft Lens , Document scanning app with OCR for digitizing notes and text , Productivity & Learning,2.5,"The OCR feature is very handy! It?s like carrying a scanner in my pocket, and the text recognition is surprisingly accurate.",19-Oct-03,162
62,CamScanner , Document scanning app with text recognition (OCR) capabilities. , AI & Photography,2.8,CamScanner turns my phone into a document scanner. It?s a lifesaver when I need to send documents on the fly.,21-Jun-20,187
63,Libby , Ebook and audiobook app connected with public libraries for free access to content , Productivity & Learning,1.6,Libby offers an incredible way to access e-books and audiobooks from the library. The interface is smooth and user-friendly.,17-Apr-21,214
64,Flip , Ecommerce app focusing on beauty products with user reviews and video content , Shopping & Beauty,4.2,I love the honest reviews on Flip. It helps me make smarter shopping choices by seeing real feedback from other users.,31-Mar-05,286
65,Wish , Ecommerce app offering discounted products directly from suppliers , Shopping & Finance,2.3,"Wish has tons of unique, low-cost items. Shipping can be slow, but I?ve found some hidden gems here.",4-May-15,262
66,eBay ," Ecommerce platform for buying and selling items, both new and used ", Shopping & Finance,1.4,"eBay is a classic for online shopping, especially for finding rare or vintage items. The bidding system keeps things exciting!",20-Dec-19,76
67,Timepage , Elegant calendar app designed to simplify scheduling and planning , Productivity & Learning,5,"Timepage?s minimalist design is beautiful, and I love its innovative heat map feature for visualizing my schedule.",16-Oct-04,124
68,Signal Messenger , End to end encrypted messaging app praised for its focus on security. , Social Media & Communication Apps,1.3,"Signal?s privacy focus makes it my go-to messaging app. The end-to-end encryption is reassuring, and it?s easy to use.",17-Mar-00,61
69,Eventbrite ," Event discovery app for concerts, classes, and networking opportunities ", Social & Events,1.5,Organizing and attending events through Eventbrite is a breeze! It?s easy to navigate and great for finding local events.,23-Nov-18,139
70,Discord , Evolved from a gaming communication tool to a popular general chat platform. , Social Media & Communication Apps,1.8,"Discord is my favorite platform for chatting and gaming. The voice channels are reliable, and community features are robust.",10-Nov-18,239
71,Fitbit , Expanded features to include health monitoring and insights. , Health & Fitness,4.9,"Fitbit keeps me motivated to stay active. I enjoy tracking my steps, sleep, and workouts with this app.",4-May-23,187
72,Duolingo , Expanded to include diverse language offerings and gamified learning. , Productivity & Learning,2.6,Duolingo?s gamified approach makes learning languages fun. I?ve actually picked up a lot of vocabulary through it.,30-Oct-19,158
73,TikTok , Exploded in popularity for short form video sharing. , Social Media & Communication Apps,5,"TikTok is addictive and fun! I enjoy the creative videos, and the algorithm does a great job of showing me content I like.",2-Sep-03,195
74,PayPal , Extended its services to include cryptocurrency transactions. , Shopping & Finance,1.3,PayPal is easy for online transactions and secure. It?s my go-to for transferring money quickly.,24-Apr-19,226
75,Hay Day , Farm simulation game where players manage and grow a virtual farm. , Gaming,3.6,Hay Day is a relaxing game. I enjoy managing my farm and trading with other players to grow my crops.,5-Jul-06,154
76,SHEIN , Fast fashion app with features like live shopping events. , Shopping & Finance,3.6,SHEIN offers trendy fashion at affordable prices. I love the variety and often find styles that fit my budget.,15-Aug-10,198
77,Brawl Stars , Fast paced team based multiplayer game from the creators of Clash Royale. , Gaming,3.7,A fast-paced and thrilling game with great character designs. I can easily play a quick match whenever I have a few minutes.,19-Apr-15,222
78,Kumu ," Filipino live streaming app with interactive games, live chat, and content creation. ", Video and Entertainment,3.7,Kumu is unique with its interactive live-streaming features. I enjoy connecting with other users and playing games together.,10-Sep-10,52
79,Mint , Financial management app for budgeting and expense tracking , Shopping & Finance,4.6,"Mint has transformed how I budget. It automatically categorizes my transactions, making it easy to track spending.",8-Apr-02,104
80,Honey , Finds and applies discount codes for online shopping , Shopping & Finance,3.4,Honey makes saving money easy! The automatic coupon feature has saved me a lot on online purchases.,24-May-06,93
81,Fishbrain ," Fishing app where users can share catches, tips, and find popular spots ", Outdoors & Sports,2.8,Fishbrain is great for anglers! I love connecting with other fishers and finding new spots based on real catches.,6-Jul-20,276
82,Sweat , Fitness app featuring workouts and training plans for all levels , Health & Fitness,3.2,"Sweat has amazing workout programs, especially for women. It?s helped me stay consistent and motivated.",30-Jun-15,146
83,Sweat , Fitness app offering workout programs by renowned trainers like Kayla Itsines. , Health & Fitness,4.9,"I love Sweat?s variety of workouts. The app has a program for every goal, and the trainers keep it interesting.",16-Aug-19,291
84,Sweatcoin , Fitness app that tracks steps and rewards users with digital currency , Health & Fitness,1.9,Sweatcoin is so motivating! Earning rewards just for walking makes getting active more fun.,9-Jun-00,83
85,Sweat , Fitness app with workout programs from trainers like Kayla Itsines , Health & Fitness,1.3,The Sweat app keeps my workouts interesting with structured programs that suit different fitness levels and goals.,13-Aug-03,224
86,Pacer ," Fitness tracker that monitors daily steps, activity, and exercise ", Health & Fitness,2.9,"Pacer is perfect for tracking my daily steps. The social challenges keep me motivated, and it?s easy to use.",3-Jul-16,134
87,Fabulous , Focuses on habit formation for health and productivity. , Health & Fitness,3.9,Fabulous is my go-to app for building better habits. Its personalized approach makes healthy routines easier to stick with.,26-Mar-21,161
88,Grubhub , Food delivery app partnering with local restaurants , Food & Drink,1.1,Grubhub?s vast restaurant options and reliable delivery make it my top choice for ordering food.,17-Sep-20,108
89,DoorDash , Food delivery app that partners with restaurants for quick delivery services. , Shopping & Finance,1.1,DoorDash is convenient and efficient. I appreciate the updates on my order?s progress and the wide restaurant selection.,3-Aug-15,117
90,LibriVox , Free audiobooks app with classic literature read by volunteers , Audio & Literature,4.5,"LibriVox is a gem for free audiobooks. The library is extensive, and I love the classic literature collection.",23-Sep-03,116
91,Pluto TV , Free streaming service offering live TV and ondemand movies in a cable style interface. , Video and Entertainment,2.2,Pluto TV offers free streaming with plenty of channels. It?s great for catching up on news and classic shows.,12-Jan-15,141
92,Tubi TV , Free streaming service with a large library of movies and TV shows. , Video and Entertainment,4.4,Tubi has a surprising amount of free movies and TV shows. It?s ad-supported but totally worth it for the content.,24-Dec-16,254
93,Fiverr , Freelance service marketplace where users can buy and sell digital services , Shopping & Finance,1.3,Fiverr makes finding freelance work easy. I?ve used it to hire talented professionals for various projects.,27-Aug-08,175
94,Roblox , Gained a massive following with user generated gaming content. , Productivity & Learning,4.4,"Roblox is an amazing platform for creativity. The games are endless, and I enjoy creating and exploring user-made worlds.",11-Dec-09,63
95,Venmo , Gained popularity with peer to peer payments and crypto options. , Shopping & Finance,4.3,"Venmo simplifies splitting bills with friends. The social feed is fun, and transactions are always smooth.",24-Feb-08,149
96,Signal , Gained traction due to its strong privacy features. , Social Media & Communication Apps,3.2,Signal is my go-to for private messaging. I trust its security features and appreciate its easy-to-use interface.,6-Jan-08,71
97,Lensa AI , Gained viral status with its AI based art generation and portrait tools. , AI & Photography,4.3,"Lensa?s AI editing is impressive! The portrait enhancements are subtle and look natural, unlike some other apps.",14-Oct-05,252
98,Snapseed , Googleü??s photoediting app with a variety of effects and tools for professionals. , AI & Photography,3.6,Snapseed is powerful for a free editing app. I love the precision tools and how easy it is to adjust my photos.,9-Jun-06,220
99,MapMyRun ," GPS based app for tracking running routes, distance, and stats. ", Health & Fitness,3.1,MapMyRun is excellent for tracking routes and progress. The community aspect is a nice bonus for motivation.,23-Jun-19,202
100,Canva ," Graphic design platform offering templates for social media, presentations, and more ", Productivity & Learning,3.8,Canva makes graphic design accessible to everyone. The templates are beautiful and easy to customize.,4-Feb-17,53
101,Instagram , Grew rapidly with new features like Stories. , Social Media & Communication Apps,2.8,Instagram keeps me connected and inspired. I love following creators and discovering new trends and ideas.,19-Feb-21,276
102,Instacart , Grocery delivery service allowing customers to order from local stores , Shopping & Finance,2,Instacart is convenient for grocery shopping without leaving home. The delivery is usually prompt and accurate.,19-Jan-02,254
103,Instacart , Grocery delivery service that partners with local stores for sameday delivery , Shopping & Finance,3.2,"Instacart?s interface is easy to navigate, and I love the ability to choose replacement items when something?s out of stock.",19-Jan-13,265
104,Habitica ," Habit and productivity app that gamifies goals, turning tasks into quests and rewards. ", Productivity & Learning,2.5,"Habitica gamifies my daily goals and tasks, making productivity so much more fun and rewarding!",28-Sep-06,300
105,Max ," HBO Max rebranded as Max, expanding its media offerings significantly. ", Video and Entertainment,2.3,"Max has expanded its library, and I love its mix of movies and original content. It?s worth the subscription.",17-Jun-01,169
106,Zocdoc , Health app for finding doctors and booking appointments easily , Health & Wellness,2.2,Zocdoc makes finding a doctor so much easier. I can read reviews and book appointments in a few clicks.,11-Aug-10,170
107,Noom , Health app that uses psychology for sustainable weight loss and habit change. , Health & Fitness,4.4,Noom?s psychology-based approach to weight loss is refreshing. The daily lessons help me make better choices.,31-Jan-07,51
108,GasBuddy , Helps users find nearby gas stations with the lowest fuel prices , Utilities & Navigation,2.4,GasBuddy is my go-to for finding the cheapest gas nearby. It?s saved me quite a bit on fuel.,28-Dec-01,221
